Change Type,Patient,Doctor,Date of Service,Appointment Status,Details
DELETED,Joseph Peroutka, Adam Siegel,2025-12-19,Complete,Record removed from file 2
DELETED,Thomas B. Baca, Jacob Huffman,2025-12-19,Scribble Made Ready for Doctor,Record removed from file 2
DELETED,Johanna DiVirgilio, Jacob Ivey,2025-12-19,Bumped,Record removed from file 2
DELETED,Salvatore Midili III, Jacob Ivey,2025-12-19,Bumped,Record removed from file 2
DELETED,Veronica Oviedo, Jacob Ivey,2025-12-19,Bumped,Record removed from file 2
DELETED,Kathleen Healy, James Cottom,2025-12-19,Ready for Exam Room,Record removed from file 2
DELETED,Ana M. Filapello, Heather Wilson,2025-12-19,Ready for Exam Room,Record removed from file 2
ADDED,JOSEPH PEROUTKA,TREVOR BADDALOO,2025-12-19,,New record in file 2
